{
  "$schema": "../core/registries/schemas/module.schema.json",
  "id": "writer",
  "version": "1.17.0",
  "name": "Fantasy Book Writer",
  "description": "AI-assisted fantasy book writing with structured organization, world-building, and token-budgeted context generation",
  "provides": {
    "agents": [
      "ai-book-writer",
      "ai-world-builder",
      "ai-prose-writer"
    ],
    "skills": [
      "organizing-books",
      "writing-prose",
      "building-worlds"
    ],
    "capabilities": [
      "book-writing",
      "prose-generation",
      "world-building",
      "character-management",
      "narrative-structure",
      "style-enforcement",
      "book-organization",
      "context-generation"
    ],
    "scripts": [],
    "cli-commands": [
      {
        "name": "writer init",
        "type": "create",
        "skill": "organizing-books",
        "template": "book-project.template",
        "description": "Initialize a new book project with folder structure"
      },
      {
        "name": "writer create-part",
        "type": "create",
        "skill": "organizing-books",
        "template": "part.template.md",
        "description": "Create a new part (story arc) with auto-numbering"
      },
      {
        "name": "writer create-chapter",
        "type": "create",
        "skill": "organizing-books",
        "template": "chapter.template.md",
        "description": "Create a new chapter within a part"
      },
      {
        "name": "writer create-scene",
        "type": "create",
        "skill": "organizing-books",
        "template": "scene.template.md",
        "description": "Create a new scene within a chapter"
      },
      {
        "name": "writer create-character",
        "type": "create",
        "skill": "organizing-books",
        "template": "character.template.md",
        "description": "Create a new character profile"
      },
      {
        "name": "writer create-world-rule",
        "type": "create",
        "skill": "organizing-books",
        "template": "world-rule.template.md",
        "description": "Create an immutable world rule or law"
      },
      {
        "name": "writer create-region",
        "type": "create",
        "skill": "organizing-books",
        "template": "region.template.md",
        "description": "Create an expandable geographic region"
      },
      {
        "name": "writer create-nation",
        "type": "create",
        "skill": "organizing-books",
        "template": "nation.template.md",
        "description": "Create an expandable nation or political entity"
      },
      {
        "name": "writer create-magic-system",
        "type": "create",
        "skill": "organizing-books",
        "template": "magic-system.template.md",
        "description": "Create an immutable magic system"
      },
      {
        "name": "writer create-history-event",
        "type": "create",
        "skill": "organizing-books",
        "template": "history-event.template.md",
        "description": "Create an append-only historical event"
      },
      {
        "name": "writer init-baseline",
        "type": "create",
        "skill": "organizing-books",
        "template": "baseline.template.md",
        "description": "Initialize book baseline (world state at book start)"
      },
      {
        "name": "writer validate",
        "type": "validate",
        "skill": "organizing-books",
        "schema": "book-structure.schema.json",
        "description": "Validate book structure, references, and metadata"
      },
      {
        "name": "writer validate-immutability",
        "type": "validate",
        "skill": "organizing-books",
        "schema": "world-lock.schema.json",
        "description": "Verify world fact immutability (hash verification)"
      },
      {
        "name": "writer add-fact",
        "type": "update",
        "skill": "organizing-books",
        "description": "Append content to an append-only or expandable fact"
      },
      {
        "name": "writer lock-fact",
        "type": "update",
        "skill": "organizing-books",
        "description": "Lock an expandable fact to immutable"
      },
      {
        "name": "writer generate-context",
        "type": "create",
        "skill": "organizing-books",
        "description": "Generate token-budgeted context files for AI writing"
      },
      {
        "name": "writer build",
        "type": "transform",
        "skill": "organizing-books",
        "description": "Build project: validate, generate context, analyze"
      },
      {
        "name": "writer analyze",
        "type": "transform",
        "skill": "organizing-books",
        "description": "Run analysis: character graph, timeline, word counts"
      },
      {
        "name": "writer export",
        "type": "export",
        "skill": "organizing-books",
        "description": "Export manuscript to markdown or HTML"
      }
    ]
  },
  "requires": {},
  "optional-dependencies": [
    "core"
  ],
  "context": {
    "process": []
  },
  "metadata": {
    "status": "wip",
    "statusNote": "Templates not yet created. CLI commands are defined but template files are pending implementation.",
    "category": "workflow",
    "keywords": [
      "writing",
      "fantasy",
      "book",
      "world-building",
      "narrative",
      "prose",
      "fiction",
      "creative-writing"
    ]
  }
}
