{
  "$schema": "../core/registries/schemas/module.schema.json",
  "id": "coding",
  "version": "1.0.0",
  "name": "Development & Coding",
  "description": "Software development agents for architecture design, code implementation, and quality assurance",
  "provides": {
    "agents": [
      "ai-architect",
      "ai-app-developer"
    ],
    "skills": [
      "designing-architecture",
      "implementing-code",
      "structuring-code"
    ],
    "capabilities": [
      "architecture-design",
      "code-implementation",
      "code-organization",
      "file-structure-guidance",
      "readability-assessment",
      "code-review",
      "test-writing"
    ]
  },
  "requires": {},
  "optional-dependencies": [
    "core"
  ],
  "metadata": {
    "category": "development",
    "keywords": [
      "coding",
      "architecture",
      "development",
      "implementation",
      "testing"
    ]
  }
}
